{
  "schemaVersion": 1,
  "uri": "urn:threadleaf:spec:v1:cli",
  "threadleafVersion": "0.1.0-beta.8",
  "cliSchemaVersion": 1,
  "commands": [
    {
      "id": "help",
      "syntax": ["help"],
      "output": "Full or command-specific usage without opening a vault",
      "authority": "Static CLI contract",
      "status": "implemented",
      "source": "src/cli/schema.ts#CliCommandId",
      "documentation": "docs/cli.md#current-commands"
    },
    {
      "id": "completion",
      "syntax": ["completion"],
      "output": "Deterministic bash, zsh, fish, or PowerShell completion script without opening a vault",
      "authority": "Static CLI command schema",
      "status": "implemented",
      "source": "src/cli/schema.ts#CliCommandId",
      "documentation": "docs/cli.md#current-commands"
    },
    {
      "id": "vault.info",
      "syntax": ["vault info", "vault:info"],
      "output": "Canonical path and note, heading, tag, and link counts",
      "authority": "Read-only kernel plus derived index",
      "status": "implemented",
      "source": "src/cli/schema.ts#CliCommandId",
      "documentation": "docs/cli.md#current-commands"
    },
    {
      "id": "file",
      "syntax": ["file"],
      "output": "Path, name, extension, byte size, and filesystem timestamps",
      "authority": "Safe visible-file inventory",
      "status": "implemented",
      "source": "src/cli/schema.ts#CliCommandId",
      "documentation": "docs/cli.md#current-commands"
    },
    {
      "id": "files",
      "syntax": ["files"],
      "output": "Sorted visible file paths with folder, extension, and count filters",
      "authority": "Safe visible-file inventory",
      "status": "implemented",
      "source": "src/cli/schema.ts#CliCommandId",
      "documentation": "docs/cli.md#current-commands"
    },
    {
      "id": "folder",
      "syntax": ["folder"],
      "output": "Recursive file count, folder count, and byte size",
      "authority": "Safe visible-file inventory",
      "status": "implemented",
      "source": "src/cli/schema.ts#CliCommandId",
      "documentation": "docs/cli.md#current-commands"
    },
    {
      "id": "folders",
      "syntax": ["folders"],
      "output": "Sorted visible folder paths with parent and count filters",
      "authority": "Safe visible-file inventory",
      "status": "implemented",
      "source": "src/cli/schema.ts#CliCommandId",
      "documentation": "docs/cli.md#current-commands"
    },
    {
      "id": "wordcount",
      "syntax": ["wordcount"],
      "output": "Unicode word and grapheme-character counts for one Markdown note",
      "authority": "Read-only kernel",
      "status": "implemented",
      "source": "src/cli/schema.ts#CliCommandId",
      "documentation": "docs/cli.md#current-commands"
    },
    {
      "id": "read",
      "syntax": ["read"],
      "output": "UTF-8 note content",
      "authority": "Read-only kernel",
      "status": "implemented",
      "source": "src/cli/schema.ts#CliCommandId",
      "documentation": "docs/cli.md#current-commands"
    },
    {
      "id": "search",
      "syntax": ["search"],
      "output": "Ranked matching paths with folder, limit, case, count, and text/JSON controls",
      "authority": "Derived metadata and full-text index",
      "status": "implemented",
      "source": "src/cli/schema.ts#CliCommandId",
      "documentation": "docs/cli.md#current-commands"
    },
    {
      "id": "search.context",
      "syntax": ["search:context"],
      "output": "Grep-style matching source lines with folder, limit, case, and text/JSON controls",
      "authority": "Derived metadata and full-text index",
      "status": "implemented",
      "source": "src/cli/schema.ts#CliCommandId",
      "documentation": "docs/cli.md#current-commands"
    },
    {
      "id": "links",
      "syntax": ["links"],
      "output": "Ordered outgoing targets, totals, and rich occurrence resolution states",
      "authority": "Derived metadata index",
      "status": "implemented",
      "source": "src/cli/schema.ts#CliCommandId",
      "documentation": "docs/cli.md#current-commands"
    },
    {
      "id": "backlinks",
      "syntax": ["backlinks"],
      "output": "Resolved source notes, totals, counts, and JSON/TSV/CSV formats",
      "authority": "Derived metadata index",
      "status": "implemented",
      "source": "src/cli/schema.ts#CliCommandId",
      "documentation": "docs/cli.md#current-commands"
    },
    {
      "id": "unresolved",
      "syntax": ["unresolved"],
      "output": "Grouped non-resolved targets plus counts, sources, and rich occurrences",
      "authority": "Derived metadata index",
      "status": "implemented",
      "source": "src/cli/schema.ts#CliCommandId",
      "documentation": "docs/cli.md#current-commands"
    },
    {
      "id": "orphans",
      "syntax": ["orphans"],
      "output": "Notes with no resolved incoming source",
      "authority": "Derived metadata index",
      "status": "implemented",
      "source": "src/cli/schema.ts#CliCommandId",
      "documentation": "docs/cli.md#current-commands"
    },
    {
      "id": "deadends",
      "syntax": ["deadends"],
      "output": "Notes with no parsed outgoing internal-link occurrence",
      "authority": "Derived metadata index",
      "status": "implemented",
      "source": "src/cli/schema.ts#CliCommandId",
      "documentation": "docs/cli.md#current-commands"
    },
    {
      "id": "outline",
      "syntax": ["outline"],
      "output": "Ordered headings in tree, Markdown, JSON, total, or rich source-line form",
      "authority": "Derived metadata index",
      "status": "implemented",
      "source": "src/cli/schema.ts#CliCommandId",
      "documentation": "docs/cli.md#current-commands"
    },
    {
      "id": "create",
      "syntax": ["create"],
      "output": "Created or explicitly overwritten Markdown path and revision, optionally rendered from a template",
      "authority": "Recoverable writer plus bounded template reader",
      "status": "implemented",
      "source": "src/cli/schema.ts#CliCommandId",
      "documentation": "docs/cli.md#current-commands"
    },
    {
      "id": "daily",
      "syntax": ["daily"],
      "output": "Opened or created daily-note path, outcome, and selected template",
      "authority": "Read-before-create plus recoverable no-clobber writer",
      "status": "implemented",
      "source": "src/cli/schema.ts#CliCommandId",
      "documentation": "docs/cli.md#current-commands"
    },
    {
      "id": "daily.path",
      "syntax": ["daily:path"],
      "output": "Expected daily-note path, whether or not it exists",
      "authority": "Explicit folder and Moment-compatible date format",
      "status": "implemented",
      "source": "src/cli/schema.ts#CliCommandId",
      "documentation": "docs/cli.md#current-commands"
    },
    {
      "id": "daily.read",
      "syntax": ["daily:read"],
      "output": "Saved daily-note content and path in JSON",
      "authority": "Explicit daily-note path plus read-only kernel",
      "status": "implemented",
      "source": "src/cli/schema.ts#CliCommandId",
      "documentation": "docs/cli.md#current-commands"
    },
    {
      "id": "daily.append",
      "syntax": ["daily:append"],
      "output": "Updated daily-note path and revision",
      "authority": "Shared revision-checked text mutation service",
      "status": "implemented",
      "source": "src/cli/schema.ts#CliCommandId",
      "documentation": "docs/cli.md#current-commands"
    },
    {
      "id": "daily.prepend",
      "syntax": ["daily:prepend"],
      "output": "Updated daily-note path and revision",
      "authority": "Shared revision-checked text mutation service",
      "status": "implemented",
      "source": "src/cli/schema.ts#CliCommandId",
      "documentation": "docs/cli.md#current-commands"
    },
    {
      "id": "append",
      "syntax": ["append"],
      "output": "Updated Markdown path and revision",
      "authority": "Revision-checked recoverable writer",
      "status": "implemented",
      "source": "src/cli/schema.ts#CliCommandId",
      "documentation": "docs/cli.md#current-commands"
    },
    {
      "id": "prepend",
      "syntax": ["prepend"],
      "output": "Updated Markdown path and revision",
      "authority": "Revision-checked recoverable writer",
      "status": "implemented",
      "source": "src/cli/schema.ts#CliCommandId",
      "documentation": "docs/cli.md#current-commands"
    },
    {
      "id": "move",
      "syntax": ["move"],
      "output": "Preview or committed source, destination, rewrites, and written revisions",
      "authority": "Whole-vault proof plus compound recovery journal",
      "status": "implemented",
      "source": "src/cli/schema.ts#CliCommandId",
      "documentation": "docs/cli.md#current-commands"
    },
    {
      "id": "rename",
      "syntax": ["rename"],
      "output": "Preview or committed same-folder destination, rewrites, and written revisions",
      "authority": "Whole-vault proof plus compound recovery journal",
      "status": "implemented",
      "source": "src/cli/schema.ts#CliCommandId",
      "documentation": "docs/cli.md#current-commands"
    },
    {
      "id": "delete",
      "syntax": ["delete"],
      "output": "Source and recoverable trash paths",
      "authority": "Revision-checked recoverable rename",
      "status": "implemented",
      "source": "src/cli/schema.ts#CliCommandId",
      "documentation": "docs/cli.md#current-commands"
    },
    {
      "id": "trash.list",
      "syntax": ["trash list", "trash:list"],
      "output": "Original path, trash path, revision, and byte size",
      "authority": "Dedicated read-only trash inspection",
      "status": "implemented",
      "source": "src/cli/schema.ts#CliCommandId",
      "documentation": "docs/cli.md#current-commands"
    },
    {
      "id": "restore",
      "syntax": ["restore"],
      "output": "Trash and restored paths",